image number,alt,article_heading,article_url
image_1_1.jpg,"Kamala Harris, in a dark suit and white shirt, raises her right hand while speaking at a lectern outdoors.",Jobs Report Adds to Economic Momentum for Harris,https://www.nytimes.com/2024/10/04/business/jobs-report-harris-economy.html
image_2_1.jpg,"A woman walking past a now hiring"" sign.""","The Job Market Is Chugging Along, Completing a Solid Economic Picture",https://www.nytimes.com/2024/10/04/business/economy/job-market-hiring-wage.html
image_3_1.jpg,No alt attribute,Labor Market Shows Unexpected Strength,https://www.nytimes.com/2024/10/04/business/economy/jobs-report-september.html
image_4_1.jpg,"Hector Xu, Kris Frey and Yiou He stand in front of a blue helicopter in an airplane hangar with an American flag on the back wall.","Pandemic Start-Ups Are Thriving, and Helping to Fuel the Economy",https://www.nytimes.com/2024/10/04/business/economy/pandemic-startups-small-business-economy.html
image_4_2.jpg,A person sits in a chair in front of multiple screens holding a joystick near an electronic panel many colorful buttons.,"Pandemic Start-Ups Are Thriving, and Helping to Fuel the Economy",https://www.nytimes.com/2024/10/04/business/economy/pandemic-startups-small-business-economy.html
image_4_3.jpg,A person pulls the tail of a small blue and white helicopter in an airplane hangar.,"Pandemic Start-Ups Are Thriving, and Helping to Fuel the Economy",https://www.nytimes.com/2024/10/04/business/economy/pandemic-startups-small-business-economy.html
image_5_1.jpg,"A person with arms raised, wearing a neon yellow vest, holds a sign that says, Automation hurts families."" Shipping containers and cranes are in the background.""",Port Union Agrees to Suspend Strike,https://www.nytimes.com/2024/10/03/business/economy/port-strike-suspended.html
image_5_2.jpg,"A person in a dark blue suit speaks to a group of people holding cameras and microphones, with people by a large plane in the background.",Port Union Agrees to Suspend Strike,https://www.nytimes.com/2024/10/03/business/economy/port-strike-suspended.html
image_5_3.jpg,"A crowd of people surround a smiling person in a blue sweatshirt and a black hat, outdoors near a temporary tent.",Port Union Agrees to Suspend Strike,https://www.nytimes.com/2024/10/03/business/economy/port-strike-suspended.html
image_6_1.jpg,A person in a blue vest and a person in a black jacket talk to people in law enforcement wearing khaki green shirts and tan vests.,U.S. Faces Economic Turbulence Just as Recession Fears Eased,https://www.nytimes.com/2024/10/03/us/politics/us-economy-inflation-port-strike-helene-israel.html
image_7_1.jpg,"A factory floor with three men standing alongside a large metal cabinet twice their height, its doors open.","To Revive Manufacturing, How Much Can a President Do?",https://www.nytimes.com/2024/10/03/business/economy/manufacturing-jobs-trump-harris.html
image_8_1.jpg,"Wreckage of homes in floodwaters, with homes on stilts in the distance still standing. Palm trees and blue sky are in the background. ","Hurricane Helene Deaths Will Continue for Years, Study Suggests",https://www.nytimes.com/2024/10/02/business/economy/hurricane-helene-deaths-climate.html
image_9_1.jpg,"A view of the kitchen, with food laid out in stainless steel trays and chefs in aprons at work. In one corner a woman is cutting lemons.","A Fancy New Restaurant in London, Staffed by the Recently Homeless",https://www.nytimes.com/2024/10/01/world/europe/restaurant-london-homeless.html
image_9_2.jpg,"A view of the restaurant from outside after dark, showing a large, well-lit room filled with people through the windows.","A Fancy New Restaurant in London, Staffed by the Recently Homeless",https://www.nytimes.com/2024/10/01/world/europe/restaurant-london-homeless.html
image_10_1.jpg,"Former President Donald J. Trump, wearing a blue suit and a red tie, speaks at a lectern with a large stadium of people surrounding him and signs saying “Trump Vance 2024” and “Make America Great Again” projected behind him.","Trump’s Plans Could Spur Inflation While Slowing Growth, Study Finds",https://www.nytimes.com/2024/09/26/business/economy/trump-economy-inflation-growth.html