image number,alt,article_heading
image_b8c1f4c9cce4136f7596b9b0ce3b3024.jpg,Manhattan DA Alvin Bragg enters courtroom for Harvey Weinstein hearing at Manhattan Supreme Court,Harvey Weinstein has sexual assault charges dropped by UK prosecutors
image_15c2cdd4b2229bfa26eaf740c3c191fa.jpg,Harvey Weinstein,Harvey Weinstein has sexual assault charges dropped by UK prosecutors
image_85e2e2432235ac173e07b763d2dfbba3.jpg,Suspected migrant vessel,Another migrant boat spotted on English Channel day after mass-casualty wreck
image_544e9f77ce94f8adb403b731d8addbe2.jpg,Grenfell Tower fire,Government regulatory failures made London's Grenfell Tower a 'death trap' report says
image_d3151d46bf124c7c3ac9e8a750790713.jpg,Astronaut reports hearing 'strange noise' coming from troubled Starliner,NASA provides explanation for 'strange noises' coming from Starliner spacecraft
image_44f31b491e0154e52d41e33f09224961.jpg,Butch Wilmore and Suni Williams,NASA provides explanation for 'strange noises' coming from Starliner spacecraft
image_e0f93ba03f48a07bcaad8202c1020806.jpg,Boeing-Astronaut Launch,NASA provides explanation for 'strange noises' coming from Starliner spacecraft
image_6c59d9a74477c19eac5fb0fdb15f2f5c.jpg,The balloon-shaped Starliner spacecraft is docked to the Harmony module of the International Space Station high above Egypt's Mediterranean coast.,NASA provides explanation for 'strange noises' coming from Starliner spacecraft
image_df7bba679cbd76857f6d6d7a1895dda4.jpg,'CyberGuy': You’ll now be able to charge your devices on the moon,You’ll now be able to charge your devices on the moon
image_edd05d3bf8b9753426acd6aa6a1a2059.jpg,You’ll now be able to charge your devices on the moon,You’ll now be able to charge your devices on the moon
image_edd05d3bf8b9753426acd6aa6a1a2059.jpg,You’ll now be able to charge your devices on the moon,You’ll now be able to charge your devices on the moon
image_edd05d3bf8b9753426acd6aa6a1a2059.jpg,You’ll now be able to charge your devices on the moon,You’ll now be able to charge your devices on the moon
image_edd05d3bf8b9753426acd6aa6a1a2059.jpg,You’ll now be able to charge your devices on the moon,You’ll now be able to charge your devices on the moon
image_1dac051d6359103efb0eccf2c3c4e1c4.jpg,NASA astronaut reports ‘strange noises’ coming from Starliner capsule,NASA astronaut stuck in space reports ‘strange noises’ coming from troubled Starliner capsule
image_4743e593c68c36c4df1bbc8f3e3f6bc4.jpg,Boeing-Astronaut Launch,NASA astronaut stuck in space reports ‘strange noises’ coming from troubled Starliner capsule
image_62db11f15ec6be2d642a1c77b1deb6b0.jpg,Butch Wilmore and Suni Williams,NASA astronaut stuck in space reports ‘strange noises’ coming from troubled Starliner capsule
image_5e19609b29a84af4e2c346ad5a429ed8.jpg,Germany Afghanistan Deportations Solingen,Germany deports 28 Afghan nationals to their homeland the first since the Taliban takeover in 2021
image_2e1521031946b385555c3d6cba9eae46.jpg,Emergency services and police at a stabbing scene in Germany Friday,Germany deports 28 Afghan nationals to their homeland the first since the Taliban takeover in 2021
image_7604817aee9df23d298cb6ab78f4c2ad.jpg,Czech WWII Bomb,Explosive experts safely detonate a rare World War II bomb at major chemical plant
image_c62af92d576e8d08755bde2678e02cf3.jpg,We brought polio vaccinations to the people of Gaza: Danny Danon,WHO to deliver 1.3M polio vaccine doses to 640K children in Gaza
image_73fa324140f1a5dffeb28076fe2de714.jpg,Displaced Gazans gather in a tent camp in Deir al-Balah.,WHO to deliver 1.3M polio vaccine doses to 640K children in Gaza
image_edb71740b0f45c8b248147c9fbb7dbcb.jpg,Loran Cole mugshot,Florida convict to be executed for killing college student in forest raping another
