image number,alt,article_heading,article_url
image_1_1.jpg,"Donald Trump stands straight, wearing a blue suit, white shirt and red tie. A crowd is behind him.",Trump Rally in Michigan Dominated by More False Statements,https://www.nytimes.com/2024/10/03/us/politics/trump-rally-michigan.html
image_2_1.jpg,No alt attribute,"Walz, Appealing to Muslim Voters, Says War in Gaza ‘Must End Now’",https://www.nytimes.com/2024/10/03/us/politics/walz-gaza-israel-muslims-emgage.html
image_3_1.jpg,JD Vance standing at a lectern during his debate. He’s wearing a dark suit and red tie. The CBS News America Decides logo is behind him.,"At the Debate, JD Vance Put a Lifetime of Spin to Use",https://www.nytimes.com/2024/10/03/us/politics/vance-trumpism-analysis.html
image_4_1.jpg,"Melania Trump, wearing red, smiling as she appears at the Republican National Convention.",5 Takeaways From Melania Trump’s Book,https://www.nytimes.com/2024/10/04/us/politics/melania-trump-book-abortion-2020-election.html
image_5_1.jpg,"Donald J. Trump, wearing a blue suit and red tie, is speaking into a microphone while standing in front of a group people.","In North Carolina Town Hall, Trump Makes a Series of Promises to Appeal to Veterans",https://www.nytimes.com/2024/10/04/us/politics/trump-town-hall-promises-veterans.html
image_6_1.jpg,"A handful of people are standing near Donald J. Trump as he surveys a smoldering landscape in the aftermath of the Camp Fire in Paradise, Calif., in 2018.",Aides Say Trump Resisted Sending Federal Funds After California Wildfires,https://www.nytimes.com/2024/10/04/us/politics/trump-wildfire-aid-california.html
image_7_1.jpg,No alt attribute,It’s Not World War III. But Foreign Conflicts May Get Uglier Before Election Day.,https://www.nytimes.com/2024/10/04/us/politics/election-israel-iran.html
image_8_1.jpg,President Biden at a podium in the White House briefing room. Reporters sit in front of him.,Reporter Asks Biden if He Would Reconsider Dropping Out of the Race,https://www.nytimes.com/2024/10/04/us/politics/biden-drop-out-2024-election.html
image_9_1.jpg,"Jamie Dimon, wearing a dark suit jacket and blue dress shirt, is gesturing with his right hand.",Trump Falsely Promotes Endorsement From Banker Who Hasn’t Endorsed Him,https://www.nytimes.com/2024/10/04/us/politics/trump-dimon-false-endorsement.html
image_10_1.jpg,Donald Trump speaking into a microphone at a lectern.,Trump Takes Aim at Legal Immigration,https://www.nytimes.com/2024/10/04/us/politics/trump-takes-aim-at-legal-immigration.html
